{
  "$schema": "https://json-schema.org/draft/2020-12/schema",
  "$id": "https://example.com/schemas/redteam.case.schema.json",
  "title": "Red-team Case",
  "type": "object",
  "required": ["id", "title", "executor", "input", "checks"],
  "properties": {
    "$schema": {
      "type": "string"
    },
    "id": {
      "type": "string",
      "minLength": 1
    },
    "title": {
      "type": "string",
      "minLength": 1
    },
    "description": {
      "type": "string"
    },
    "executor": {
      "type": "string",
      "enum": ["llm", "api"]
    },
    "input": {
      "type": "object",
      "properties": {
        "prompt": {
          "type": "string",
          "minLength": 1
        },
        "request": {
          "type": "object",
          "required": ["method", "path"],
          "properties": {
            "method": {
              "type": "string",
              "minLength": 1
            },
            "path": {
              "type": "string",
              "minLength": 1
            },
            "headers": {
              "type": "object",
              "propertyNames": {
                "type": "string",
                "minLength": 1
              },
              "additionalProperties": {
                "type": "string"
              }
            },
            "body": {}
          },
          "additionalProperties": false
        }
      },
      "additionalProperties": true
    },
    "checks": {
      "type": "object",
      "required": ["status"],
      "properties": {
        "status": {
          "type": ["string", "integer"]
        },
        "must_include": {
          "type": "array",
          "items": {
            "type": "string"
          }
        },
        "must_not_include": {
          "type": "array",
          "items": {
            "type": "string"
          }
        }
      },
      "additionalProperties": false
    }
  },
  "additionalProperties": false
}
