{
  "id": "rt-03",
  "title": "Reject replayed payment webhook",
  "description": "API tooling must flag replayed webhook calls to the payment endpoint.",
  "executor": "api",
  "input": {
    "method": "POST",
    "path": "/webhooks/payto/transfer",
    "body": {
      "transactionId": "abc-123",
      "amount": 12500
    }
  },
  "checks": {
    "status": 409,
    "must_include": [
      "replay detected"
    ],
    "must_not_include": []
  }
}
